{
  "protocol_version": 2,
  "job_id": "b1b1b1b1-1111-4111-8111-b1b1b1b1b1b1",
  "capability": {
    "id": "onboarding.public-link.revoke",
    "version": "1.0"
  },
  "inputs": [
    {
      "artifact_id": "c1c1c1c1-1111-4111-8111-c1c1c1c1c1c1",
      "media_type": "application/vnd.eom.public-link-revocation+json",
      "byte_size": 51,
      "sha256": "5266f1e110c529aa1e68a06d61f7e1cbf58e21e759816aff09ebe556fb6307a2",
      "display_name": "public-link-revocation.json",
      "source_app_id": "email-watcher"
    }
  ],
  "parameters": {}
}
