{
  "protocol_version": 2,
  "job_id": "e6e6e6e6-2222-4222-8222-e6e6e6e6e6e6",
  "capability": {
    "id": "onboarding.draft.approve-send",
    "version": "1.0"
  },
  "inputs": [
    {
      "artifact_id": "f7f7f7f7-3333-4333-8333-f7f7f7f7f7f7",
      "media_type": "application/vnd.eom.onboarding-draft-approval+json",
      "byte_size": 51,
      "sha256": "5266f1e110c529aa1e68a06d61f7e1cbf58e21e759816aff09ebe556fb6307a2",
      "display_name": "onboarding-draft-approval.json",
      "source_app_id": "email-watcher"
    }
  ],
  "parameters": {}
}
